{
  "version": 1,
  "id": "zhtw-project-formal-llm-semantic-v1",
  "created_date": "2026-07-24",
  "authorship": "Project-original Simplified Chinese formal-writing and LLM semantic-preservation scenarios drafted by Codex for input-only review; no converter output or expected text was used.",
  "input_only": true,
  "converter_output_used": false,
  "cases": [
    {"id": "formal-001", "input": "法院应依照法定程序审理案件，并保障双方陈述意见的机会。"},
    {"id": "formal-002", "input": "宪法解释程序启动后，相关机关应在期限内提交意见书。"},
    {"id": "formal-003", "input": "委员会通过决议前，应先确认出席人数达到法定门槛。"},
    {"id": "formal-004", "input": "法案经表决通过后，仍须依规定完成公布程序。"},
    {"id": "formal-005", "input": "公司计划发行公司债，以筹措长期建设所需资金。"},
    {"id": "formal-006", "input": "中央银行将发行纪念币，但不会改变现行货币政策。"},
    {"id": "formal-007", "input": "出版社预计明年发行修订版，并保留原作者序言。"},
    {"id": "formal-008", "input": "主管机关发布调查报告时，应同时公开统计方法。"},
    {"id": "formal-009", "input": "市政府发布最新人口统计，并说明资料修订原因。"},
    {"id": "formal-010", "input": "博物馆将持续保存文化遗产，并改善典藏环境。"},
    {"id": "formal-011", "input": "调查人员必须妥善保存证据，以供后续审理使用。"},
    {"id": "formal-012", "input": "档案馆决定保存原始文件，不以扫描副本取代正本。"},
    {"id": "formal-013", "input": "研究对象均已签署同意书，并可随时退出研究。"},
    {"id": "formal-014", "input": "本项服务的对象包括独居长者与行动不便者。"},
    {"id": "formal-015", "input": "多数委员支持这项提案，但要求补充财政影响评估。"},
    {"id": "formal-016", "input": "工会表示支持协商结果，并将向会员完整说明。"},
    {"id": "formal-017", "input": "法院裁定停止执行原处分，直到诉讼结果确定。"},
    {"id": "formal-018", "input": "承办机关应确实执行决议，不得自行增加限制条件。"},
    {"id": "formal-019", "input": "图表中的水平线代表基准值，垂直线代表观察日期。"},
    {"id": "formal-020", "input": "实验结果符合质量守恒定律，误差也在容许范围内。"},
    {"id": "formal-021", "input": "研究团队重新测量样本质量，以排除仪器校准误差。"},
    {"id": "formal-022", "input": "修复人员保留了建筑原有窗口，没有改成封闭墙面。"},
    {"id": "formal-023", "input": "代表团结束访问后，将发布双方共同声明。"},
    {"id": "formal-024", "input": "记者访问多位居民，确认事件发生时的现场情况。"},
    {"id": "formal-025", "input": "公司完成清算后，才能申请注销登记。"},
    {"id": "formal-026", "input": "主管机关不得以注销账号代替注销公司登记。"},
    {"id": "formal-027", "input": "这项研究应用既有理论解释新发现，没有改变原始定义。"},
    {"id": "formal-028", "input": "铁路终端车站将在施工期间维持部分月台开放。"},
    {"id": "formal-029", "input": "偏远地区需要长期医疗支持，不能只依赖短期巡回服务。"},
    {"id": "formal-030", "input": "消息人士拒绝透露姓名，但提供了可独立核实的文件。"},
    {"id": "formal-031", "input": "消费者可以在法定期间内解除契约并请求退款。"},
    {"id": "formal-032", "input": "比赛项目分为个人组与团体组，计分方式各不相同。"},
    {"id": "formal-033", "input": "统计模型包含三个变量，并分别报告估计值与信赖区间。"},
    {"id": "formal-034", "input": "该函数在定义域内连续，但不保证处处可微分。"},
    {"id": "formal-035", "input": "服务对象的需求不同，补助标准不宜一律相同。"},
    {"id": "formal-036", "input": "电视节目将完整播出访谈，不剪除受访者的重要说明。"},
    {"id": "formal-037", "input": "指挥官部署救援人员时，应保留紧急撤离通道。"},
    {"id": "formal-038", "input": "港口发现受损容器后，立即划设安全区域。"},
    {"id": "formal-039", "input": "镜像中的文字左右相反，这是光学反射造成的现象。"},
    {"id": "formal-040", "input": "地方分支机构可以受理申请，但无权变更审查标准。"},
    {"id": "formal-041", "input": "工厂将更新流水线，同时保留熟练员工的操作岗位。"},
    {"id": "formal-042", "input": "演员在首场演出的表现稳定，获得多数评论肯定。"},
    {"id": "formal-043", "input": "车站统计尖峰时段旅客流量，作为调整班次的依据。"},
    {"id": "formal-044", "input": "转运中心是区域交通节点，连接铁路与公路运输。"},
    {"id": "formal-045", "input": "船长在航海日志中记录天气、航向与设备状况。"},
    {"id": "formal-046", "input": "主管机关决定撤销原处分，并重新进行调查。"},
    {"id": "formal-047", "input": "审议结果返回委员会后，还需安排第二次表决。"},
    {"id": "formal-048", "input": "专家建议扩展保护范围，但不要改变法律定义。"},
    {"id": "formal-049", "input": "搜救队沿既定路径前进，并在每个节点回报位置。"},
    {"id": "formal-050", "input": "大会发布命令后，各单位依原定程序执行疏散。"},
    {"id": "llm-001", "input": "模型摘要法律文件时，必须保留程序与程式之间的语义差异。"},
    {"id": "llm-002", "input": "模型应先判断文件是正式文书还是计算机文件，再选择适当用词。"},
    {"id": "llm-003", "input": "回答不得把发行股票写成发布股票，也不能混淆公告发布。"},
    {"id": "llm-004", "input": "翻译内容提到保存古迹时，不应套用保存计算机资料的说法。"},
    {"id": "llm-005", "input": "模型需要区分研究对象、结婚对象与程序设计对象。"},
    {"id": "llm-006", "input": "物理问题中的质量表示物理量，不是产品品质。"},
    {"id": "llm-007", "input": "几何题中的水平是方向，不是能力或发展程度。"},
    {"id": "llm-008", "input": "图片描述中的窗口是建筑构件，不一定是软件界面。"},
    {"id": "llm-009", "input": "餐厅菜单与软件导航菜单可能需要不同的本地化处理。"},
    {"id": "llm-010", "input": "外交访问与系统访问属于不同语境，模型不得混为一谈。"},
    {"id": "llm-011", "input": "地址可能指邮寄地点，也可能出现在网络配置说明中。"},
    {"id": "llm-012", "input": "远程山区与远程连接的语境不同，摘要时应保留原意。"},
    {"id": "llm-013", "input": "新闻中的消息人士不是系统中的消息消费者。"},
    {"id": "llm-014", "input": "消费者保护文章中的消费者是一般民众，不是队列处理程序。"},
    {"id": "llm-015", "input": "行政事务与数据库事务不能因为写法相同就视为同一概念。"},
    {"id": "llm-016", "input": "教材中的实例是说明案例，云端文件中的实例则可能指运算资源。"},
    {"id": "llm-017", "input": "光学镜像与容器镜像的定义不同，回答时应说明所属领域。"},
    {"id": "llm-018", "input": "军事部署与软件部署使用相同词形，但执行对象并不相同。"},
    {"id": "llm-019", "input": "组织分支与代码分支都可简称分支，模型必须依上下文判断。"},
    {"id": "llm-020", "input": "铁路终端与命令行终端不是同一种设施或工具。"},
    {"id": "llm-021", "input": "港口新闻中的端口可能只是原文误用，模型应先确认语境。"},
    {"id": "llm-022", "input": "会议主持人与计算机主机没有相同含义，模型不应机械对应。"},
    {"id": "llm-023", "input": "餐厅服务人员与网络服务器都提供服务，但指涉对象不同。"},
    {"id": "llm-024", "input": "公共图书馆与软件程序库都可能被简称为库，回答应避免歧义。"},
    {"id": "llm-025", "input": "快递包裹与软件包属于不同领域，翻译时不能只看单字。"},
    {"id": "llm-026", "input": "产品类别与程序设计类都涉及分类，但术语用法并不完全相同。"},
    {"id": "llm-027", "input": "原文中的同一个词可能指农田，也可能指资料字段，模型应参考整句。"},
    {"id": "llm-028", "input": "数学函数与程序函数应分别采用所属领域的惯用名称。"},
    {"id": "llm-029", "input": "数学变量与模板变量可以同名，但不得擅自修改变量内容。"},
    {"id": "llm-030", "input": "执行法院判决与执行自动化任务的法律效果完全不同。"},
    {"id": "llm-031", "input": "撤销行政处分不等于复原界面上的最后一步操作。"},
    {"id": "llm-032", "input": "经济恢复与备份恢复的对象不同，摘要不能省略关键名词。"},
    {"id": "llm-033", "input": "应用科学理论与开启移动应用程序属于不同动作。"},
    {"id": "llm-034", "input": "扩展保护范围与安装浏览器扩展功能不可混写。"},
    {"id": "llm-035", "input": "装载货物与加载网页虽然都涉及载入，但语境不同。"},
    {"id": "llm-036", "input": "链条的连接处与网页链接不一定采用相同表达。"},
    {"id": "llm-037", "input": "商品标签与界面分页标签应根据实际功能分别描述。"},
    {"id": "llm-038", "input": "登山路径与文件路径都表示路线，但使用场景并不相同。"},
    {"id": "llm-039", "input": "道路流量与网络流量的单位不同，模型不得合并数值。"},
    {"id": "llm-040", "input": "交通节点与运算节点可能出现在同一份智慧城市报告中。"},
    {"id": "llm-041", "input": "舞台表现与系统性能都可评价好坏，但指标并不相同。"},
    {"id": "llm-042", "input": "记者回应与接口响应的主体不同，生成摘要时应清楚标示。"},
    {"id": "llm-043", "input": "个人日记与系统日志都记录事件，但隐私要求不同。"},
    {"id": "llm-044", "input": "统计指标与监控指标可以共用名称，但计算方式必须分开说明。"},
    {"id": "llm-045", "input": "追踪包裹与分布式追踪使用不同技术，不应共用操作步骤。"},
    {"id": "llm-046", "input": "人的记忆与计算机内存不是同一个概念，类比时要注明限制。"},
    {"id": "llm-047", "input": "模型引用专有名词时，应保持官方名称，不要自行套用地域词。"},
    {"id": "llm-048", "input": "引文中的术语必须忠实保留，解释文字才可依目标读者调整。"},
    {"id": "llm-049", "input": "一句话同时出现多个可能含义时，模型应指出歧义而不是猜测。"},
    {"id": "llm-050", "input": "上下文不足以判断术语含义时，应请求补充信息再继续处理。"}
  ]
}
