{
  "version": 1,
  "id": "zhtw-project-llm-it-ui-baseline-v1",
  "created_date": "2026-07-28",
  "authorship": "Project-original Simplified Chinese LLM, IT, and UI baseline scenarios drafted by Codex for input-only review; no converter output or expected text was used.",
  "input_only": true,
  "converter_output_used": false,
  "cases": [
    {"id": "llm-001", "input": "模型回答前会先检查问题是否包含必要背景。"},
    {"id": "llm-002", "input": "摘要应保留原文中的时间顺序和因果关系。"},
    {"id": "llm-003", "input": "系统会把较长的文件分段后再进行检索。"},
    {"id": "llm-004", "input": "助手发现要求互相冲突时会请用户进一步说明。"},
    {"id": "llm-005", "input": "评估人员逐项检查回答是否符合引用内容。"},
    {"id": "llm-006", "input": "模型需要区分事实陈述和推测性意见。"},
    {"id": "llm-007", "input": "系统会记录每次评估使用的提示版本。"},
    {"id": "llm-008", "input": "回答过长时，助手应优先保留与问题直接相关的内容。"},
    {"id": "llm-009", "input": "检索结果不足时，不应编造缺少的资料。"},
    {"id": "llm-010", "input": "人工复核完成后，案例会移出待处理队列。"},
    {"id": "llm-011", "input": "模型会根据前一轮反馈调整说明方式。"},
    {"id": "llm-012", "input": "评估报告分别统计正确、部分正确和错误的回答。"},
    {"id": "llm-013", "input": "助手应明确说明哪些结论来自用户提供的资料。"},
    {"id": "llm-014", "input": "训练资料更新后，旧的评估结果仍会保留。"},
    {"id": "llm-015", "input": "系统会检查生成内容是否遗漏关键限制条件。"},
    {"id": "llm-016", "input": "多轮对话中，模型应保持术语和称呼一致。"},
    {"id": "llm-017", "input": "回答包含计算过程时，需要同时列出使用的条件。"},
    {"id": "llm-018", "input": "助手无法执行请求时，应提供清楚且具体的原因。"},
    {"id": "llm-019", "input": "检索系统会过滤与当前问题无关的段落。"},
    {"id": "llm-020", "input": "评审人员可以标记语义正确但表达不自然的回答。"},
    {"id": "llm-021", "input": "模型输出会先经过格式检查，再显示给用户。"},
    {"id": "llm-022", "input": "系统会比较不同提示产生的回答稳定性。"},
    {"id": "llm-023", "input": "助手应避免把相关性误写成因果关系。"},
    {"id": "llm-024", "input": "资料来源互相矛盾时，回答应呈现主要差异。"},
    {"id": "llm-025", "input": "评估案例会依照领域和风险程度分组。"},
    {"id": "llm-026", "input": "模型生成清单时应维持项目之间的层级关系。"},
    {"id": "llm-027", "input": "系统只会保存完成任务所需的对话内容。"},
    {"id": "llm-028", "input": "回答引用数字时，需要确认单位没有改变。"},
    {"id": "llm-029", "input": "助手会先整理用户目标，再提出执行步骤。"},
    {"id": "llm-030", "input": "评估人员可以为低信心案例补充判断理由。"},
    {"id": "llm-031", "input": "模型应把不确定的内容与已确认的事实分开说明。"},
    {"id": "llm-032", "input": "系统会在回答送出前检查必要字段是否齐全。"},
    {"id": "llm-033", "input": "检索片段会按照与问题的相关程度排序。"},
    {"id": "llm-034", "input": "助手应保留用户指定的输出顺序。"},
    {"id": "llm-035", "input": "评估结果会显示各类错误所占的比例。"},
    {"id": "llm-036", "input": "模型遇到指代不清的句子时会请求确认对象。"},
    {"id": "llm-037", "input": "系统会将重复的检索结果合并后再生成回答。"},
    {"id": "llm-038", "input": "助手应根据用户指定的语气调整文字表达。"},
    {"id": "llm-039", "input": "人工修改回答后，系统会保存修改原因。"},
    {"id": "llm-040", "input": "模型需要在结论之前说明重要的适用条件。"},
    {"id": "it-001", "input": "服务器重新启动后会自动恢复尚未完成的任务。"},
    {"id": "it-002", "input": "数据库连接中断时，客户端会进行有限次数的重试。"},
    {"id": "it-003", "input": "缓存过期后，下一次请求会重新读取资料。"},
    {"id": "it-004", "input": "部署完成前不会切换线上流量。"},
    {"id": "it-005", "input": "系统每天检查备份文件是否能够正常还原。"},
    {"id": "it-006", "input": "应用程序会把错误消息写入集中式日志。"},
    {"id": "it-007", "input": "测试环境与正式环境使用不同的数据库。"},
    {"id": "it-008", "input": "服务停止回应时，监控系统会发送通知。"},
    {"id": "it-009", "input": "队列中的任务会依照建立时间依序处理。"},
    {"id": "it-010", "input": "接口收到无效参数时会回传错误说明。"},
    {"id": "it-011", "input": "程序更新后需要重新加载配置文件。"},
    {"id": "it-012", "input": "系统会限制同一个账号同时登录的设备数量。"},
    {"id": "it-013", "input": "文件上传完成后会进行完整性检查。"},
    {"id": "it-014", "input": "调度任务失败时会保留执行记录。"},
    {"id": "it-015", "input": "网页内容更新后，旧缓存会逐步失效。"},
    {"id": "it-016", "input": "数据同步期间仍可读取上一版内容。"},
    {"id": "it-017", "input": "系统只允许经过授权的用户修改设置。"},
    {"id": "it-018", "input": "网络延迟过高时，应用程序会显示警告。"},
    {"id": "it-019", "input": "安装程序会先检查磁盘空间是否足够。"},
    {"id": "it-020", "input": "服务升级期间可能会短暂中断连接。"},
    {"id": "it-021", "input": "删除数据前，系统会要求再次确认。"},
    {"id": "it-022", "input": "账号连续登录失败后会暂时锁定。"},
    {"id": "it-023", "input": "日志会记录请求时间和处理结果。"},
    {"id": "it-024", "input": "程序会忽略重复送达的相同事件。"},
    {"id": "it-025", "input": "设置变更会在下一次启动时生效。"},
    {"id": "it-026", "input": "系统会定期清除超过保存期限的临时文件。"},
    {"id": "it-027", "input": "下载中断后可以从上次进度继续。"},
    {"id": "it-028", "input": "应用程序关闭前会保存尚未提交的修改。"},
    {"id": "it-029", "input": "权限更新后，用户需要重新登录。"},
    {"id": "it-030", "input": "服务会拒绝超过大小限制的请求。"},
    {"id": "ui-001", "input": "正在加载最新数据。"},
    {"id": "ui-002", "input": "没有符合条件的结果。"},
    {"id": "ui-003", "input": "请先选择要处理的项目。"},
    {"id": "ui-004", "input": "变更尚未保存。"},
    {"id": "ui-005", "input": "确定要离开这个页面吗？"},
    {"id": "ui-006", "input": "数据已经更新完成。"},
    {"id": "ui-007", "input": "服务器暂时没有响应。"},
    {"id": "ui-008", "input": "请检查网络连接后重试。"},
    {"id": "ui-009", "input": "目前没有待处理事项。"},
    {"id": "ui-010", "input": "已经复制到剪贴板。"},
    {"id": "ui-011", "input": "这个名称已经有人使用。"},
    {"id": "ui-012", "input": "请输入有效的电子邮件地址。"},
    {"id": "ui-013", "input": "文件大小超过允许上限。"},
    {"id": "ui-014", "input": "上传完成后即可关闭窗口。"},
    {"id": "ui-015", "input": "正在检查可用的更新。"},
    {"id": "ui-016", "input": "请至少选择一个选项。"},
    {"id": "ui-017", "input": "这项操作无法复原。"},
    {"id": "ui-018", "input": "保存成功。"},
    {"id": "ui-019", "input": "删除失败，请稍后再试。"},
    {"id": "ui-020", "input": "目前使用默认设置。"},
    {"id": "ui-021", "input": "请填写所有必填字段。"},
    {"id": "ui-022", "input": "没有权限查看这项内容。"},
    {"id": "ui-023", "input": "连接已经超时。"},
    {"id": "ui-024", "input": "请确认输入内容是否正确。"},
    {"id": "ui-025", "input": "正在准备下载。"},
    {"id": "ui-026", "input": "更新后需要重新启动。"},
    {"id": "ui-027", "input": "找不到指定的文件。"},
    {"id": "ui-028", "input": "已经恢复默认值。"},
    {"id": "ui-029", "input": "请稍候，系统正在处理。"},
    {"id": "ui-030", "input": "所有项目都已处理完成。"}
  ]
}
