{
  "version": 1,
  "id": "zhtw-project-ui-social-baseline-guard-v1",
  "created_date": "2026-07-30",
  "authorship": "Project-original Simplified Chinese UI and everyday-social baseline and preservation scenarios drafted by Codex from declared Blind-v2 coverage gaps; no converter output or expected text was used.",
  "input_only": true,
  "converter_output_used": false,
  "cases": [
    {"id": "ui-001", "input": "搜索框的提示文字会在输入内容后自动消失。"},
    {"id": "ui-002", "input": "空白状态应显示新增资料的主要按钮。"},
    {"id": "ui-003", "input": "打开通知后，系统会在锁定画面显示摘要。"},
    {"id": "ui-004", "input": "用户可以从下拉菜单选择默认语言。"},
    {"id": "ui-005", "input": "勾选复选框后才能继续提交表单。"},
    {"id": "ui-006", "input": "单选按钮一次只能选择一个项目。"},
    {"id": "ui-007", "input": "保存成功后，页面右上角会显示确认消息。"},
    {"id": "ui-008", "input": "个人资料页面会显示目前账号的电子邮件地址。"},
    {"id": "ui-009", "input": "密码输入错误三次后，账号会暂时锁定。"},
    {"id": "ui-010", "input": "关闭相机权限不会影响语音通话功能。"},
    {"id": "ui-011", "input": "视频播放失败时应提供重新加载按钮。"},
    {"id": "ui-012", "input": "打印设置会记住上次选择的打印机。"},
    {"id": "ui-013", "input": "拖动鼠标可以调整侧边栏的宽度。"},
    {"id": "ui-014", "input": "文件上传完成前请不要关闭浏览器窗口。"},
    {"id": "ui-015", "input": "新建文件夹时，名称不能为空。"},
    {"id": "ui-016", "input": "远程地址验证失败，请检查网络连接。"},
    {"id": "ui-017", "input": "相依性锁定文件应与项目版本一起提交。"},
    {"id": "ui-018", "input": "消息消费者停止后，待处理数量不会继续减少。"},
    {"id": "ui-019", "input": "类别名称最多可以输入三十个字符。"},
    {"id": "ui-020", "input": "指令范例中的参数顺序必须保持不变。"},
    {"id": "ui-021", "input": "切换深色模式后，编辑内容不会重新加载。"},
    {"id": "ui-022", "input": "日期选择器默认显示目前月份。"},
    {"id": "ui-023", "input": "列表排序方式会保存到用户偏好设置。"},
    {"id": "ui-024", "input": "筛选条件清除后，应恢复显示所有结果。"},
    {"id": "ui-025", "input": "分页控件会标示目前所在的页面。"},
    {"id": "ui-026", "input": "下载按钮在文件准备完成前保持停用。"},
    {"id": "ui-027", "input": "上传区域支持拖放多个图片文件。"},
    {"id": "ui-028", "input": "弹出窗口关闭后，键盘焦点会回到原按钮。"},
    {"id": "ui-029", "input": "错误消息应说明哪个字段需要修正。"},
    {"id": "ui-030", "input": "系统会自动保存尚未发布的草稿。"},
    {"id": "ui-031", "input": "删除前会显示受影响资料的数量。"},
    {"id": "ui-032", "input": "停用成员后，历史操作记录仍会保留。"},
    {"id": "ui-033", "input": "合并重复联系人前可以预览变更内容。"},
    {"id": "ui-034", "input": "表格栏位过多时可以水平滚动。"},
    {"id": "ui-035", "input": "工具提示会在鼠标停留时显示完整名称。"},
    {"id": "ui-036", "input": "步骤指示器会标示尚未完成的项目。"},
    {"id": "ui-037", "input": "语音输入启用后，麦克风图标会改变颜色。"},
    {"id": "ui-038", "input": "地图加载期间会显示目前位置的占位图。"},
    {"id": "ui-039", "input": "优惠券字段只接受尚未过期的代码。"},
    {"id": "ui-040", "input": "验证码将在五分钟后失效。"},
    {"id": "ui-041", "input": "API 密钥只会在建立时完整显示一次。"},
    {"id": "ui-042", "input": "GitHub 登录失败时不会建立重复账号。"},
    {"id": "ui-043", "input": "错误代码 HTTP 403 会显示在技术详情中。"},
    {"id": "ui-044", "input": "版本标签 v2.1.0 不应被自动改写。"},
    {"id": "ui-045", "input": "快捷键 Ctrl+Shift+P 会打开命令面板。"},
    {"id": "ui-046", "input": "档案编号 A-1047 会显示在页面标题旁。"},
    {"id": "ui-047", "input": "订单状态更新后，时间戳记会立即刷新。"},
    {"id": "ui-048", "input": "联络窗口变更后会通知所有管理员。"},
    {"id": "ui-049", "input": "核定名称与申请资料不同时会显示警告。"},
    {"id": "ui-050", "input": "资料检核完成后才能启用发布按钮。"},
    {"id": "social-001", "input": "我已经把聚餐地点传到群组里了。"},
    {"id": "social-002", "input": "明天下雨的话，我们就改约在室内。"},
    {"id": "social-003", "input": "请把新的联络人电话传给我。"},
    {"id": "social-004", "input": "包裹送到管理室后再通知我领取。"},
    {"id": "social-005", "input": "这张优惠券只能在实体门市使用。"},
    {"id": "social-006", "input": "周末的电影票已经全部卖完了。"},
    {"id": "social-007", "input": "我晚一点会把照片上传到共享相簿。"},
    {"id": "social-008", "input": "他的手机目前没有网络信号。"},
    {"id": "social-009", "input": "记得在出门前关闭客厅的电灯。"},
    {"id": "social-010", "input": "这家餐厅可以提前预约靠窗座位。"},
    {"id": "social-011", "input": "孩子的学校明天会提早放学。"},
    {"id": "social-012", "input": "维修人员下午会来检查热水器。"},
    {"id": "social-013", "input": "我把备用钥匙放在书桌抽屉里。"},
    {"id": "social-014", "input": "今天的垃圾要在晚上八点前拿出去。"},
    {"id": "social-015", "input": "她正在帮家人办理手机号码过户。"},
    {"id": "social-016", "input": "下班后顺路买一盒鸡蛋回来。"},
    {"id": "social-017", "input": "公车到站前，应用程序会发送提醒。"},
    {"id": "social-018", "input": "这条道路施工期间只能单向通行。"},
    {"id": "social-019", "input": "社区活动中心今晚暂停开放。"},
    {"id": "social-020", "input": "诊所已经把看诊时间改到星期五。"},
    {"id": "social-021", "input": "冰箱里的牛奶明天就会过期。"},
    {"id": "social-022", "input": "我会先确认人数再预订桌位。"},
    {"id": "social-023", "input": "邻居请我们帮忙代收挂号信。"},
    {"id": "social-024", "input": "这件外套可以放进洗衣机清洗。"},
    {"id": "social-025", "input": "超市今天的营业时间延长一小时。"},
    {"id": "social-026", "input": "我已经取消重复扣款的订阅服务。"},
    {"id": "social-027", "input": "房东答应下周更换坏掉的门锁。"},
    {"id": "social-028", "input": "会议结束后大家一起去吃午餐。"},
    {"id": "social-029", "input": "请先把药袋上的用法看清楚。"},
    {"id": "social-030", "input": "这份文件需要本人签名才能生效。"},
    {"id": "social-031", "input": "跨行汇款手续费由转账人负担。"},
    {"id": "social-032", "input": "租车费用不包含高速公路通行费。"},
    {"id": "social-033", "input": "订单取消后，退款需要三个工作日。"},
    {"id": "social-034", "input": "客服人员已经帮我更正收货地址。"},
    {"id": "social-035", "input": "这间公寓不能饲养大型宠物。"},
    {"id": "social-036", "input": "雨伞放在入口旁边的置物柜里。"},
    {"id": "social-037", "input": "我们约在捷运站第二个出口见面。"},
    {"id": "social-038", "input": "这段视频只会保留到月底。"},
    {"id": "social-039", "input": "演唱会现场不能携带外食和饮料。"},
    {"id": "social-040", "input": "请把发票号码写在报销单上。"},
    {"id": "social-041", "input": "Wi-Fi 密码贴在路由器背面。"},
    {"id": "social-042", "input": "USB-C 充电线放在黑色收纳袋里。"},
    {"id": "social-043", "input": "LINE 群组里的公告已经更新。"},
    {"id": "social-044", "input": "YouTube 链接可以直接传给参加者。"},
    {"id": "social-045", "input": "会议编号 M-204 请保留在邮件标题中。"},
    {"id": "social-046", "input": "房间号码 1208 不需要加上楼层。"},
    {"id": "social-047", "input": "取件时请出示 QR Code 和身份证件。"},
    {"id": "social-048", "input": "快递单上的 SKU 编号不要修改。"},
    {"id": "social-049", "input": "活动日期改成 8 月 16 日下午两点。"},
    {"id": "social-050", "input": "请在 RSVP 表单填写饮食需求。"}
  ]
}
