{
  "version": 1,
  "id": "zhtw-project-llm-formal-reasoning-guard-v1",
  "created_date": "2026-07-30",
  "authorship": "Project-original Simplified Chinese LLM reasoning and formal-reporting scenarios drafted by Codex from declared Blind-v2 domain and risk gaps; no converter output or expected text was used.",
  "input_only": true,
  "converter_output_used": false,
  "cases": [
    {"id": "llm-001", "input": "请根据用户提供的资料整理三项重点，不要补充未经确认的内容。"},
    {"id": "llm-002", "input": "模型应先说明假设，再给出可以验证的结论。"},
    {"id": "llm-003", "input": "如果证据不足，请明确回答目前无法判断。"},
    {"id": "llm-004", "input": "系统提示要求保留原始文件名与扩展名。"},
    {"id": "llm-005", "input": "请把会议摘要改写成适合传到群组的简短消息。"},
    {"id": "llm-006", "input": "回答中引用的页码必须对应上传文件的实际页数。"},
    {"id": "llm-007", "input": "工具调用失败后，助理应显示可执行的重试建议。"},
    {"id": "llm-008", "input": "请比较两个方案的成本、风险和相依性。"},
    {"id": "llm-009", "input": "输出只需要结论，不要重复用户已经提供的背景。"},
    {"id": "llm-010", "input": "生成的表格必须保留空白栏位，不可自行填入推测值。"},
    {"id": "llm-011", "input": "请将这段说明转换成自然的台湾技术用语。"},
    {"id": "llm-012", "input": "模型把项目负责人误写成产品负责人，需要重新核对。"},
    {"id": "llm-013", "input": "使用者要求删除记录时，助理应先确认影响范围。"},
    {"id": "llm-014", "input": "请从附件中找出核定名称、联络窗口和生效日期。"},
    {"id": "llm-015", "input": "回答应区分事实、推论和仍待确认的事项。"},
    {"id": "llm-016", "input": "如果输入包含简繁混用，请维持专有名称的原始写法。"},
    {"id": "llm-017", "input": "请用条列方式说明资料检核失败的原因。"},
    {"id": "llm-018", "input": "摘要不得省略原文中的限制条件和例外情况。"},
    {"id": "llm-019", "input": "请确认引用内容来自正文，不是模型自动生成的补充说明。"},
    {"id": "llm-020", "input": "回答前先检查问题是否缺少时间范围或适用对象。"},
    {"id": "llm-021", "input": "API 回传的 request_id 必须原样保留。"},
    {"id": "llm-022", "input": "请勿改写 JSON 字段 user_profile_id。"},
    {"id": "llm-023", "input": "模型输出中的 HTTPS URL 不应加入多余空格。"},
    {"id": "llm-024", "input": "请保留错误代码 E_AUTH_403 和括号内说明。"},
    {"id": "llm-025", "input": "版本标签 v3.2.1-rc.4 不得转换或拆分。"},
    {"id": "llm-026", "input": "引用 Git commit 7f3a9c2 时必须维持七位字符。"},
    {"id": "llm-027", "input": "模型应将变量 max_retry_count 视为程序识别码。"},
    {"id": "llm-028", "input": "请保留 SQL 条件 WHERE active = true 的大小写。"},
    {"id": "llm-029", "input": "回答中的 ISO 8601 时间 2026-07-30T09:15:00+08:00 必须完整。"},
    {"id": "llm-030", "input": "请勿翻译产品名称 ThinkPad X1 Carbon Gen 13。"},
    {"id": "llm-031", "input": "模型需要解释为什么这项建议不适用于目前账号。"},
    {"id": "llm-032", "input": "请将远程地址与本机地址分别列出。"},
    {"id": "llm-033", "input": "回答应使用相依性锁定文件中记录的实际版本。"},
    {"id": "llm-034", "input": "请先验证类别名称，再建立新的资料夹。"},
    {"id": "llm-035", "input": "模型必须区分预留位置、占位符和空白状态。"},
    {"id": "llm-036", "input": "请说明消息消费者停止后尚有多少待处理消息。"},
    {"id": "llm-037", "input": "若用户只要求繁体字转换，不要主动改写句意。"},
    {"id": "llm-038", "input": "请把搜索框提示文字维持为完整句子。"},
    {"id": "llm-039", "input": "回答中的优惠券编号 TW-2026-08 必须保持不变。"},
    {"id": "llm-040", "input": "模型应把资料来源链接放在对应结论之后。"},
    {"id": "llm-041", "input": "请避免把联络人和联络窗口当成相同栏位。"},
    {"id": "llm-042", "input": "如果文件没有核定日期，请勿使用上传日期代替。"},
    {"id": "llm-043", "input": "模型应指出这段文字可能来自旧版说明。"},
    {"id": "llm-044", "input": "请比较 Codex 与 Gemini 的判断，并列出需要人工确认的差异。"},
    {"id": "llm-045", "input": "最终回答只保留已经通过资料检核的项目。"},
    {"id": "llm-046", "input": "请不要把 Web 视图当成台湾常用的产品名称。"},
    {"id": "llm-047", "input": "模型应在引用原话时保留“due process”这个词组。"},
    {"id": "llm-048", "input": "请维持命令 zhtw validate --strict 的参数顺序。"},
    {"id": "llm-049", "input": "回答需要说明哪些结论是根据现有资料推得。"},
    {"id": "llm-050", "input": "请在输出前检查所有编号、日期和单位是否一致。"},
    {"id": "formal-001", "input": "委员会完成调查后，将公开报告与附件目录。"},
    {"id": "formal-002", "input": "主管机关要求申请人于期限内补齐证明文件。"},
    {"id": "formal-003", "input": "审计人员将核对原始凭证与授权记录。"},
    {"id": "formal-004", "input": "会议记录应完整记载出席人员提出的不同意见。"},
    {"id": "formal-005", "input": "公告内容自发布次日起正式生效。"},
    {"id": "formal-006", "input": "地方政府说明预算执行结果符合核定范围。"},
    {"id": "formal-007", "input": "法院通知当事人补正送达地址。"},
    {"id": "formal-008", "input": "调查单位尚未确认事件发生的确切时间。"},
    {"id": "formal-009", "input": "新闻稿引用的统计资料截至今年六月底。"},
    {"id": "formal-010", "input": "承办人员完成资料检核后才会进入复审程序。"},
    {"id": "formal-011", "input": "报告将事实认定与政策建议分章说明。"},
    {"id": "formal-012", "input": "机关已通知业者改善标示不清的项目。"},
    {"id": "formal-013", "input": "核定名称必须与登记资料完全一致。"},
    {"id": "formal-014", "input": "申请文件缺少适用范围与执行期间。"},
    {"id": "formal-015", "input": "委员会将在下次会议确认修正后的条文。"},
    {"id": "formal-016", "input": "公开资料未包含仍在调查中的个案。"},
    {"id": "formal-017", "input": "该项措施仅适用于公告指定的地区。"},
    {"id": "formal-018", "input": "报告指出目前证据不足以支持这项结论。"},
    {"id": "formal-019", "input": "主管机关将另行公布申请方式与审查标准。"},
    {"id": "formal-020", "input": "审议结果须经核定后才能对外发布。"},
    {"id": "formal-021", "input": "决议编号 GOV-TW-2026-041 应列在文件首页。"},
    {"id": "formal-022", "input": "附件 A-3 记载各单位的联络窗口。"},
    {"id": "formal-023", "input": "公报引用法规编号 Law No. 108-17。"},
    {"id": "formal-024", "input": "调查表保留案件代码 CASE-7B-204。"},
    {"id": "formal-025", "input": "审计报告沿用科目代码 4010-A。"},
    {"id": "formal-026", "input": "判决附件引用文件代号 A/HRC/56/12。"},
    {"id": "formal-027", "input": "委员会文件以 COM(2026) 57 final 为正式编号。"},
    {"id": "formal-028", "input": "技术规范引用 ISO/IEC 27001:2022。"},
    {"id": "formal-029", "input": "证券资料中的 ISIN US0378331005 不得改写。"},
    {"id": "formal-030", "input": "运输文件以 UN 3481 标示锂电池类别。"},
    {"id": "formal-031", "input": "声明引用“status quo ante”时维持原文拼写。"},
    {"id": "formal-032", "input": "法院文件保留当事人登记的 Chen Yu-Han。"},
    {"id": "formal-033", "input": "外交公报中的 Côte d’Ivoire 应使用官方拼写。"},
    {"id": "formal-034", "input": "专利公告以 WO 2026/098765 标示国际申请。"},
    {"id": "formal-035", "input": "财政资料将 FY2028 视为会计年度识别码。"},
    {"id": "formal-036", "input": "附件中的 Exhibit C-2 对应原始证据清单。"},
    {"id": "formal-037", "input": "公文应使用核定日期，不得改用收件日期。"},
    {"id": "formal-038", "input": "统计结果依年龄层和地区分别呈现。"},
    {"id": "formal-039", "input": "审查意见未涉及申请人的其他项目。"},
    {"id": "formal-040", "input": "公告载明不得以定型化契约条款排除责任。"},
    {"id": "formal-041", "input": "跨行汇款手续费由申请人自行负担。"},
    {"id": "formal-042", "input": "主管机关保留后续查核资料的权利。"},
    {"id": "formal-043", "input": "核定金额不包含另行支付的行政费用。"},
    {"id": "formal-044", "input": "委员会要求各单位指定单一联络窗口。"},
    {"id": "formal-045", "input": "年度报告将远程服务与现场服务分开统计。"},
    {"id": "formal-046", "input": "资料检核结果显示三笔记录需要补正。"},
    {"id": "formal-047", "input": "新闻稿说明本次修正不会影响既有权利。"},
    {"id": "formal-048", "input": "会议决议仅用于后续行政程序。"},
    {"id": "formal-049", "input": "报告附注说明计算方式与四舍五入规则。"},
    {"id": "formal-050", "input": "机关将在网站公布最终核定名单。"}
  ]
}
