{
  "version": 1,
  "id": "zhtw-project-llm-social-baseline-v1",
  "created_date": "2026-07-27",
  "authorship": "Project-original Simplified Chinese LLM and everyday social scenarios drafted by Codex for input-only review; no converter output or expected text was used.",
  "input_only": true,
  "converter_output_used": false,
  "cases": [
    {"id": "llm-001", "input": "模型根据用户上传的文件生成摘要，并标出无法确认的细节。"},
    {"id": "llm-002", "input": "请把这段会议记录整理成待办事项，不要补充原文没有的结论。"},
    {"id": "llm-003", "input": "系统会保存最近十轮对话，超过范围的消息不会传给模型。"},
    {"id": "llm-004", "input": "评估报告分别列出准确率、召回率和无法作答的比例。"},
    {"id": "llm-005", "input": "检索结果为空时，助手应说明没有找到相关资料。"},
    {"id": "llm-006", "input": "把温度调低后，模型的回答通常更稳定，但措辞也可能更重复。"},
    {"id": "llm-007", "input": "提示词要求模型先识别语言，再按照指定格式输出 JSON。"},
    {"id": "llm-008", "input": "请保留原文中的 API 名称、版本号和代码片段。"},
    {"id": "llm-009", "input": "这个工作流会先调用搜索工具，再根据来源生成带引用的回答。"},
    {"id": "llm-010", "input": "管理员可以查看令牌用量，但看不到对话中的敏感字段。"},
    {"id": "llm-011", "input": "模型把两个不同的人名合并了，需要重新检查实体对应关系。"},
    {"id": "llm-012", "input": "请只改写语气，不要改变数字、日期或否定关系。"},
    {"id": "llm-013", "input": "批量任务完成后，页面会显示成功、失败和跳过的记录数。"},
    {"id": "llm-014", "input": "知识库更新需要几分钟，新上传的内容不会立即出现在回答中。"},
    {"id": "llm-015", "input": "如果问题涉及医疗风险，助手应建议咨询合格的专业人员。"},
    {"id": "llm-016", "input": "开发者在 system prompt 中限制了可调用的工具范围。"},
    {"id": "llm-017", "input": "语音转写把专有名词听错了，编辑可以直接修改文字稿。"},
    {"id": "llm-018", "input": "请比较三个候选答案，并说明选择依据和剩余疑点。"},
    {"id": "llm-019", "input": "模型返回 429 错误后，客户端按照 Retry-After 延迟重试。"},
    {"id": "llm-020", "input": "向量索引重建期间，旧版本仍可用于线上查询。"},
    {"id": "llm-021", "input": "这个代理只能读取工单，不能修改状态或发送消息。"},
    {"id": "llm-022", "input": "请把用户问题翻译成英文后检索，但最后用中文回答。"},
    {"id": "llm-023", "input": "自动评分器认为格式正确，不代表回答内容一定准确。"},
    {"id": "llm-024", "input": "训练资料包含重复样本时，验证分数可能被高估。"},
    {"id": "llm-025", "input": "助手引用法规时必须保留条文编号和公布日期。"},
    {"id": "llm-026", "input": "请将长文分成五个主题，每个主题附上一句摘要。"},
    {"id": "llm-027", "input": "模型无法访问本地文件，除非用户明确上传或授权工具读取。"},
    {"id": "llm-028", "input": "缓存命中时仍要检查模型版本和提示词哈希是否一致。"},
    {"id": "llm-029", "input": "内容过滤器拦截了请求，但没有记录原始敏感文本。"},
    {"id": "llm-030", "input": "请根据表格计算总额，并列出任何缺失或格式异常的单元格。"},
    {"id": "llm-031", "input": "工具调用失败后，助手不应声称操作已经完成。"},
    {"id": "llm-032", "input": "评审人员只能看到输入和候选标签，不能看到产品输出。"},
    {"id": "llm-033", "input": "同一个问题连续测试三次，用来观察回答是否稳定。"},
    {"id": "llm-034", "input": "请从日志中提取 request_id，但不要输出访问令牌。"},
    {"id": "llm-035", "input": "模型在回答末尾列出信心较低的判断，方便人工复核。"},
    {"id": "llm-036", "input": "多模态输入包含图片和文字，缺少任一部分都可能影响判断。"},
    {"id": "llm-037", "input": "这个提示模板使用 {{customer_name}} 作为变量占位符。"},
    {"id": "llm-038", "input": "请维持 SQL 查询原样，只解释各个条件的用途。"},
    {"id": "llm-039", "input": "模型建议的补丁尚未执行，必须先通过测试和代码审查。"},
    {"id": "llm-040", "input": "分段策略改变后，检索到的上下文顺序也发生了变化。"},
    {"id": "llm-041", "input": "请识别客服对话中的主要诉求，不要推测用户的身份。"},
    {"id": "llm-042", "input": "安全测试用例尝试诱导模型泄露隐藏指令和内部配置。"},
    {"id": "llm-043", "input": "生成图片前，系统会检查提示内容是否符合使用政策。"},
    {"id": "llm-044", "input": "请将结果写入 CSV，并使用 UTF-8 编码保存。"},
    {"id": "llm-045", "input": "模型对罕见缩写的解释不一致，需要提供更多上下文。"},
    {"id": "llm-046", "input": "只有通过人工确认的样本才能写入最终评测答案。"},
    {"id": "llm-047", "input": "请检查回答是否遗漏例外条件，而不是只比较关键词。"},
    {"id": "llm-048", "input": "代理准备发送邮件前，应显示收件人、主题和正文供用户确认。"},
    {"id": "llm-049", "input": "新的嵌入模型上线后，旧索引需要按计划逐步重建。"},
    {"id": "llm-050", "input": "请为每项建议注明依据，无法验证的部分标记为未知。"},
    {"id": "social-001", "input": "我刚到车站，下一班车还要等二十分钟。"},
    {"id": "social-002", "input": "这家店周末人很多，最好先在网上预约。"},
    {"id": "social-003", "input": "快递放在管理处了，下班回家时记得领取。"},
    {"id": "social-004", "input": "照片有点模糊，不过还是能看清菜单上的价格。"},
    {"id": "social-005", "input": "明天可能下雨，我们把聚会改到室内吧。"},
    {"id": "social-006", "input": "我把链接发到群里了，你有空再看看。"},
    {"id": "social-007", "input": "这部电影前半段很慢，后面的节奏就好多了。"},
    {"id": "social-008", "input": "邻居说今晚会停水，大家先准备一些饮用水。"},
    {"id": "social-009", "input": "外卖少送了一份餐点，客服已经答应退款。"},
    {"id": "social-010", "input": "我的手机只剩百分之十的电，晚点再打给你。"},
    {"id": "social-011", "input": "这双鞋尺寸刚好，但走久了脚后跟会有点痛。"},
    {"id": "social-012", "input": "朋友推荐的咖啡店搬家了，地图上的地址还没更新。"},
    {"id": "social-013", "input": "我先把会议开完，午饭大概要晚半小时。"},
    {"id": "social-014", "input": "这个食谱写得很清楚，第一次做也没有失败。"},
    {"id": "social-015", "input": "房间的空调声音有点大，晚上睡觉会听见。"},
    {"id": "social-016", "input": "周五的票已经卖完了，我们改买周六下午的场次。"},
    {"id": "social-017", "input": "包裹外箱有凹痕，里面的商品倒是没有损坏。"},
    {"id": "social-018", "input": "我把钥匙忘在办公室，只好请同事帮忙送下来。"},
    {"id": "social-019", "input": "这条步道不算难走，雨后有几段会比较滑。"},
    {"id": "social-020", "input": "今天的菜有点咸，下次可以少放一点酱油。"},
    {"id": "social-021", "input": "群聊消息太多，我可能漏看了你昨天的回复。"},
    {"id": "social-022", "input": "新买的充电线接触不良，我准备拿去换货。"},
    {"id": "social-023", "input": "报名表已经提交，主办方会在下周通知结果。"},
    {"id": "social-024", "input": "我不确定这个尺寸合不合适，先去实体店试穿。"},
    {"id": "social-025", "input": "停车场入口正在施工，要从旁边的小路绕进去。"},
    {"id": "social-026", "input": "这次旅行没有排太多景点，想留点时间随便走走。"},
    {"id": "social-027", "input": "视频加载得很慢，切换到移动网络后就正常了。"},
    {"id": "social-028", "input": "我已经把账单分好了，每个人的金额都写在备注里。"},
    {"id": "social-029", "input": "店员态度很好，还主动提醒我可以使用优惠券。"},
    {"id": "social-030", "input": "活动结束得比预期早，我们九点前就能回家。"},
    {"id": "social-031", "input": "这个杯子的盖子不太紧，放进包里容易漏水。"},
    {"id": "social-032", "input": "我在门口等你，穿灰色外套、拿着蓝色雨伞。"},
    {"id": "social-033", "input": "周末想去剪头发，但熟悉的设计师刚好休假。"},
    {"id": "social-034", "input": "这篇文章标题很吸引人，内容却没有提供具体来源。"},
    {"id": "social-035", "input": "小区电梯正在保养，搬东西要改走另一栋。"},
    {"id": "social-036", "input": "我先下载离线地图，山区可能收不到信号。"},
    {"id": "social-037", "input": "生日蛋糕上的名字写错了，店家愿意重新制作。"},
    {"id": "social-038", "input": "新的耳机戴起来很舒服，通话时偶尔会有杂音。"},
    {"id": "social-039", "input": "天气突然变冷，我把厚外套从柜子里拿出来了。"},
    {"id": "social-040", "input": "我没有看到附件，麻烦你再发送一次。"},
    {"id": "social-041", "input": "这家民宿离车站很近，拖着行李走过去也不远。"},
    {"id": "social-042", "input": "晚餐不用等我，我会在公司附近简单吃一点。"},
    {"id": "social-043", "input": "订单显示已经出货，但物流编号还查不到记录。"},
    {"id": "social-044", "input": "我把旧书整理成三箱，准备周末拿去捐赠。"},
    {"id": "social-045", "input": "路线临时改道，公交车没有停靠原来的站牌。"},
    {"id": "social-046", "input": "这款饮料甜度偏高，加一点冰块会比较顺口。"},
    {"id": "social-047", "input": "维修人员上午来过，但需要订购零件才能处理。"},
    {"id": "social-048", "input": "课程录影已经上传，缺席的人可以之后补看。"},
    {"id": "social-049", "input": "我先把购物车里的东西留着，比较完价格再决定。"},
    {"id": "social-050", "input": "大家都到齐以后，我们再一起讨论周末的安排。"}
  ]
}
